{
  "receipt_type": "lm:local_benchmark_receipt",
  "receipt_version": "0.1.0",
  "benchmark_id": "run_2026-04-15T10-26-22-022Z",
  "model_id": "microsoft/phi-4",
  "endpoint": "http://10.2.0.2:1234",
  "threading_mode": "fresh_request",
  "input_ref": {
    "lm_input_path": "out_lm\\clean\\lm_input.json",
    "prompt_path": "out_lm\\clean\\lm_prompt.txt"
  },
  "run_ref": {
    "run_dir": "benchmarks\\results\\clean\\run_2026-04-15T10-26-22-022Z\\attempt_001",
    "run_index": 1
  },
  "request_config": {
    "temperature": 0
  },
  "contract_obedience": {
    "json_parse_ok": true,
    "schema_ok": true,
    "no_extra_text": false,
    "exact_response_type": true,
    "required_non_claims_present": true,
    "correct_authority_posture": true,
    "passed": false
  },
  "repeatability_surface": {
    "raw_output_hash": "b2cba8bad22ba3c0d195e515258f35a1dfbbe7d752fc9c2c2c34f64edc5859cd",
    "normalized_output_hash": "66e74976de4be026f2b2f19c871a630f023796c11ec5549d443c8356369e5440",
    "observation_count": 5,
    "question_count": 2
  },
  "usefulness": {
    "observation_count": 5,
    "question_count": 2,
    "authority_drift_count": 0,
    "empty_observation_count": 0,
    "duplicate_question_count": 0
  },
  "response_ref": {
    "raw_path": "benchmarks\\results\\clean\\run_2026-04-15T10-26-22-022Z\\attempt_001\\raw.txt",
    "parsed_path": "benchmarks\\results\\clean\\run_2026-04-15T10-26-22-022Z\\attempt_001\\parsed.json",
    "validation_path": "benchmarks\\results\\clean\\run_2026-04-15T10-26-22-022Z\\attempt_001\\validation.json",
    "benchmark_path": "benchmarks\\results\\clean\\run_2026-04-15T10-26-22-022Z\\attempt_001\\benchmark.json"
  },
  "api_stats": {
    "input_tokens": 651,
    "total_output_tokens": 283,
    "reasoning_output_tokens": 0,
    "tokens_per_second": 8.470335269638008,
    "time_to_first_token_seconds": 0.876
  }
}
